[
  {
    "pair_id": "pair_001",
    "assignment_id": "assignment_01_threaded_prime_count",
    "language": "c",
    "submission_a_id": "sub_0001",
    "submission_b_id": "sub_0002",
    "submission_a_archive": "submissions/2024F/assignment_01_threaded_prime_count/sub_0001/submission.zip",
    "submission_b_archive": "submissions/2024F/assignment_01_threaded_prime_count/sub_0002/submission.zip",
    "template_a_archive": "templates/assignment_01_threaded_prime_count/template.zip",
    "template_b_archive": "templates/assignment_01_threaded_prime_count/template.zip",
    "should_flag_for_review": true,
    "label_meaning": "true means similarity should be sent to a human reviewer; false means it should not be flagged on this benchmark",
    "source_type": "synthetic_historical_like",
    "notes": "Same chunking strategy and trial-division prime logic with renamed identifiers and layout changes."
  },
  {
    "pair_id": "pair_002",
    "assignment_id": "assignment_01_threaded_prime_count",
    "language": "c",
    "submission_a_id": "sub_0001",
    "submission_b_id": "sub_0003",
    "submission_a_archive": "submissions/2024F/assignment_01_threaded_prime_count/sub_0001/submission.zip",
    "submission_b_archive": "submissions/2024F/assignment_01_threaded_prime_count/sub_0003/submission.zip",
    "template_a_archive": "templates/assignment_01_threaded_prime_count/template.zip",
    "template_b_archive": "templates/assignment_01_threaded_prime_count/template.zip",
    "should_flag_for_review": false,
    "label_meaning": "true means similarity should be sent to a human reviewer; false means it should not be flagged on this benchmark",
    "source_type": "synthetic_historical_like",
    "notes": "Same assignment, but one uses threaded trial division and the other uses a sieve."
  },
  {
    "pair_id": "pair_003",
    "assignment_id": "assignment_01_threaded_prime_count",
    "language": "c",
    "submission_a_id": "sub_0001",
    "submission_b_id": "sub_0004",
    "submission_a_archive": "submissions/2024F/assignment_01_threaded_prime_count/sub_0001/submission.zip",
    "submission_b_archive": "submissions/2024F/assignment_01_threaded_prime_count/sub_0004/submission.zip",
    "template_a_archive": "templates/assignment_01_threaded_prime_count/template.zip",
    "template_b_archive": "templates/assignment_01_threaded_prime_count/template.zip",
    "should_flag_for_review": true,
    "label_meaning": "true means similarity should be sent to a human reviewer; false means it should not be flagged on this benchmark",
    "source_type": "synthetic_historical_like",
    "notes": "Same logic split across two files; multi-file variant closely tracks original structure."
  },
  {
    "pair_id": "pair_004",
    "assignment_id": "assignment_01_threaded_prime_count",
    "language": "c",
    "submission_a_id": "sub_0002",
    "submission_b_id": "sub_0003",
    "submission_a_archive": "submissions/2024F/assignment_01_threaded_prime_count/sub_0002/submission.zip",
    "submission_b_archive": "submissions/2024F/assignment_01_threaded_prime_count/sub_0003/submission.zip",
    "template_a_archive": "templates/assignment_01_threaded_prime_count/template.zip",
    "template_b_archive": "templates/assignment_01_threaded_prime_count/template.zip",
    "should_flag_for_review": false,
    "label_meaning": "true means similarity should be sent to a human reviewer; false means it should not be flagged on this benchmark",
    "source_type": "synthetic_historical_like",
    "notes": "Assignment overlap only; different algorithmic core."
  },
  {
    "pair_id": "pair_005",
    "assignment_id": "assignment_01_threaded_prime_count",
    "language": "c",
    "submission_a_id": "sub_0002",
    "submission_b_id": "sub_0004",
    "submission_a_archive": "submissions/2024F/assignment_01_threaded_prime_count/sub_0002/submission.zip",
    "submission_b_archive": "submissions/2024F/assignment_01_threaded_prime_count/sub_0004/submission.zip",
    "template_a_archive": "templates/assignment_01_threaded_prime_count/template.zip",
    "template_b_archive": "templates/assignment_01_threaded_prime_count/template.zip",
    "should_flag_for_review": true,
    "label_meaning": "true means similarity should be sent to a human reviewer; false means it should not be flagged on this benchmark",
    "source_type": "synthetic_historical_like",
    "notes": "Likely copied/refactored threaded-trial-division solution."
  },
  {
    "pair_id": "pair_006",
    "assignment_id": "assignment_02_gradebook_csv",
    "language": "c",
    "submission_a_id": "sub_0005",
    "submission_b_id": "sub_0006",
    "submission_a_archive": "submissions/2025W/assignment_02_gradebook_csv/sub_0005/submission.zip",
    "submission_b_archive": "submissions/2025W/assignment_02_gradebook_csv/sub_0006/submission.zip",
    "template_a_archive": "templates/assignment_02_gradebook_csv/template.zip",
    "template_b_archive": "templates/assignment_02_gradebook_csv/template.zip",
    "should_flag_for_review": true,
    "label_meaning": "true means similarity should be sent to a human reviewer; false means it should not be flagged on this benchmark",
    "source_type": "synthetic_historical_like",
    "notes": "Same scanf-based parsing and same arithmetic pattern with cosmetic changes."
  },
  {
    "pair_id": "pair_007",
    "assignment_id": "assignment_02_gradebook_csv",
    "language": "c",
    "submission_a_id": "sub_0005",
    "submission_b_id": "sub_0007",
    "submission_a_archive": "submissions/2025W/assignment_02_gradebook_csv/sub_0005/submission.zip",
    "submission_b_archive": "submissions/2025W/assignment_02_gradebook_csv/sub_0007/submission.zip",
    "template_a_archive": "templates/assignment_02_gradebook_csv/template.zip",
    "template_b_archive": "templates/assignment_02_gradebook_csv/template.zip",
    "should_flag_for_review": false,
    "label_meaning": "true means similarity should be sent to a human reviewer; false means it should not be flagged on this benchmark",
    "source_type": "synthetic_historical_like",
    "notes": "Same task but different parsing approach using fgets/strtok."
  },
  {
    "pair_id": "pair_008",
    "assignment_id": "assignment_02_gradebook_csv",
    "language": "c",
    "submission_a_id": "sub_0005",
    "submission_b_id": "sub_0008",
    "submission_a_archive": "submissions/2025W/assignment_02_gradebook_csv/sub_0005/submission.zip",
    "submission_b_archive": "submissions/2025W/assignment_02_gradebook_csv/sub_0008/submission.zip",
    "template_a_archive": "templates/assignment_02_gradebook_csv/template.zip",
    "template_b_archive": "templates/assignment_02_gradebook_csv/template.zip",
    "should_flag_for_review": false,
    "label_meaning": "true means similarity should be sent to a human reviewer; false means it should not be flagged on this benchmark",
    "source_type": "synthetic_historical_like",
    "notes": "Shared template and output format, but weighted-average logic differs materially."
  },
  {
    "pair_id": "pair_009",
    "assignment_id": "assignment_02_gradebook_csv",
    "language": "c",
    "submission_a_id": "sub_0006",
    "submission_b_id": "sub_0007",
    "submission_a_archive": "submissions/2025W/assignment_02_gradebook_csv/sub_0006/submission.zip",
    "submission_b_archive": "submissions/2025W/assignment_02_gradebook_csv/sub_0007/submission.zip",
    "template_a_archive": "templates/assignment_02_gradebook_csv/template.zip",
    "template_b_archive": "templates/assignment_02_gradebook_csv/template.zip",
    "should_flag_for_review": false,
    "label_meaning": "true means similarity should be sent to a human reviewer; false means it should not be flagged on this benchmark",
    "source_type": "synthetic_historical_like",
    "notes": "Independent-looking implementations within same assignment."
  },
  {
    "pair_id": "pair_010",
    "assignment_id": "cross_assignment",
    "language": "c",
    "submission_a_id": "sub_0001",
    "submission_b_id": "sub_0005",
    "submission_a_archive": "submissions/2024F/assignment_01_threaded_prime_count/sub_0001/submission.zip",
    "submission_b_archive": "submissions/2025W/assignment_02_gradebook_csv/sub_0005/submission.zip",
    "template_a_archive": "templates/assignment_01_threaded_prime_count/template.zip",
    "template_b_archive": "templates/assignment_02_gradebook_csv/template.zip",
    "should_flag_for_review": false,
    "label_meaning": "true means similarity should be sent to a human reviewer; false means it should not be flagged on this benchmark",
    "source_type": "synthetic_historical_like",
    "notes": "Different assignments and domains."
  },
  {
    "pair_id": "pair_011",
    "assignment_id": "cross_assignment",
    "language": "c",
    "submission_a_id": "sub_0004",
    "submission_b_id": "sub_0008",
    "submission_a_archive": "submissions/2024F/assignment_01_threaded_prime_count/sub_0004/submission.zip",
    "submission_b_archive": "submissions/2025W/assignment_02_gradebook_csv/sub_0008/submission.zip",
    "template_a_archive": "templates/assignment_01_threaded_prime_count/template.zip",
    "template_b_archive": "templates/assignment_02_gradebook_csv/template.zip",
    "should_flag_for_review": false,
    "label_meaning": "true means similarity should be sent to a human reviewer; false means it should not be flagged on this benchmark",
    "source_type": "synthetic_historical_like",
    "notes": "Different assignments and domains."
  }
]